title,category,start_datetime_local,end_datetime_local,location_name,address_text,city,source,source_url,scraped_at,start_dt,end_dt,start_date,start_hour
"“produrre oggi, tra sotterranei e mainstream (senza perdere la direzione)”",,2025-11-22T00:00:00+01:00,,Dazio Levante,"Piazza Sempione, 1, Milano, Sempione",Milan,milanotoday,https://www.milanotoday.it/eventi/produrre-oggi-tra-sotterranei-e-mainstream-senza-perdere-la-direzione-believe-italua.html,2025-12-22T16:46:30.332931+01:00,2025-11-22 00:00:00+01:00,,2025-11-22,0.0
"L'estate (gratis) alla Fabbrica del Vapore tra concerti, teatro e cinema all'aperto",Fabbrica del Vapore,2025-01-06T00:00:00+01:00,,Fabbrica del Vapore,", Milano, ",Milan,milanotoday,https://www.milanotoday.it/eventi/programma-concerti-teatro-fabbrica-del-vapore-2025.html,2025-12-22T16:46:33.677298+01:00,2025-01-06 00:00:00+01:00,,2025-01-06,0.0
L'estate a Villa Arconati tra giochi d'acqua e una speciale caccia al tesoro,Villa Arconati,2025-01-08T00:00:00+01:00,,Villa Arconati,"Via Fametta, 1, Bollate, ",Milan,milanotoday,https://www.milanotoday.it/eventi/programma-estate-2025-villa-arconati.html,2025-12-22T16:46:36.229850+01:00,2025-01-08 00:00:00+01:00,,2025-01-08,0.0
La maxi sagra alle porte di Milano con piatti tipici e spettacolo pirotecnico,feste patronali,2025-08-30T00:00:00+02:00,,Oratorio di Garbatola,"Via San Francesco D'Assisi, Nerviano, ",Milan,milanotoday,https://www.milanotoday.it/eventi/programma-festa-garbatola-2025-.html,2025-12-22T16:46:39.734448+01:00,2025-08-30 00:00:00+02:00,,2025-08-30,0.0
Psichedelici e diritti alla cura,,2025-06-10T00:00:00+02:00,,Casa dei Diritti,"Via Edmondo de Amicis, 10, Milano, Porta Ticinese",Milan,milanotoday,https://www.milanotoday.it/eventi/psichedelici-e-diritti-alla-cura-luca-granata-mauro-toffetti-cristiana-zerosi-e-riccardo-bettiga.html,2025-12-22T16:46:43.079050+01:00,2025-06-10 00:00:00+02:00,,2025-06-10,0.0
Putridarium,,2025-10-20T00:00:00+02:00,,Amy d Arte Spazio,"Via Lovanio, 6, Milano, Porta Volta",Milan,milanotoday,https://www.milanotoday.it/eventi/putridarium-olmo-erba.html,2025-12-22T16:46:46.897695+01:00,2025-10-20 00:00:00+02:00,,2025-10-20,0.0
Qonto presenta la founders night di powerup e annuncia i premi per l’edizione 2025,,2025-09-18T00:00:00+02:00,,I Chiostri di San Barnaba,"Via San Barnaba, 48, Milano, Porta Romana",Milan,milanotoday,https://www.milanotoday.it/eventi/qonto-presenta-la-founders-night-di-powerup-e-annuncia-i-premi-per-l-edizione-2025-qonto.html,2025-12-22T16:46:49.762501+01:00,2025-09-18 00:00:00+02:00,,2025-09-18,0.0
Quarto tempo: cacao mental ed.,,2025-11-14T00:00:00+01:00,,Gipsy – Biblioteca di Lambrate,"Via Carlo Valvassori Peroni, 56, Milano, Città Studi",Milan,milanotoday,https://www.milanotoday.it/eventi/quarto-tempo-cacao-mental-ed-cacao-mental.html,2025-12-22T16:46:53.446229+01:00,2025-11-14 00:00:00+01:00,,2025-11-14,0.0
Torna Quattrozampeinfiera 2025: tutte le informazioni,animali,2025-04-10T00:00:00+02:00,,Parco Esposizioni Novegro,", Segrate, ",Milan,milanotoday,https://www.milanotoday.it/eventi/quattrozampe-fiera-2025.html,2025-12-22T16:46:56.177620+01:00,2025-04-10 00:00:00+02:00,,2025-04-10,0.0
Quello che mi piace: Daniele Mazzoleni,,2025-10-28T00:00:00+01:00,,Spazio Quattrocento – Opificio 31,"Via Tortona, 31, Milano, Tortona",Milan,milanotoday,https://www.milanotoday.it/eventi/quello-che-mi-piace-daniele-mazzoleni-daniele-mazzoleni.html,2025-12-22T16:47:00.371547+01:00,2025-10-28 00:00:00+01:00,,2025-10-28,0.0
“Questo è papà”. Il nuovo libro dell’ambasciatore e presidente del Mcf Davide Vinciprova,,2025-08-12T00:00:00+02:00,,Strada,"Piazza del Duomo, 1, Milano, Duomo",Milan,milanotoday,https://www.milanotoday.it/eventi/questo-e-papa-il-nuovo-libro-dell-ambasciatore-e-presidente-del-mcf-davide-vinciprova-per-riaccendere-il-dibattito-sull-importanza-della-figura-paterna-davide-vinciprova.html,2025-12-22T16:47:03.538612+01:00,2025-08-12 00:00:00+02:00,,2025-08-12,0.0
Una giornata di divertimento e di beneficenza all'Europark Idroscalo,Europark Idroscalo,2025-02-10T00:00:00+01:00,,EuroPark Milano Idroscalo,"Via Rivoltana, 264, Segrate, ",Milan,milanotoday,https://www.milanotoday.it/eventi/raccolta-fondi-europark-idroscalo-giostre.html,2025-12-22T16:47:07.357707+01:00,2025-02-10 00:00:00+01:00,,2025-02-10,0.0
Dalla luce di Raffaello all’ombra di Caravaggio: visita guidata a Brera,,2025-06-07T00:00:00+02:00,,Davanti ingresso Esterno Pinacoteca,"Via Brera, 28, Milano, Brera",Milan,milanotoday,https://www.milanotoday.it/eventi/raffaello-all-ombra-di-caravaggio-visita-guidata-a-brera-italia-in-tour.html,2025-12-22T16:47:10.495957+01:00,2025-06-07 00:00:00+02:00,,2025-06-07,0.0
Rallentare: festival dei ritmi sostenibili,,2025-04-10T00:00:00+02:00,,Fondazione Culturale San Fedele,"Via Ulrico Hoepli, 3B, Milano, Duomo",Milan,milanotoday,https://www.milanotoday.it/eventi/rallentare-festival-dei-ritmi-sostenibili.html,2025-12-22T16:47:13.055381+01:00,2025-04-10 00:00:00+02:00,,2025-04-10,0.0
Il fascino dei libri prende vita a Milano: emozioni e incontri d’autore per gli amanti della lettura,librerie,,,,,Milan,milanotoday,https://www.milanotoday.it/eventi/rassegna-eventi-mondadori.html,2025-12-22T16:47:16.145172+01:00,,,,
La rassegna di libri e podcast a Casa Emergency per ripudiare la guerra,Emergency,2025-06-11T00:00:00+02:00,,CASA EMERGENCY,"Via Santa Croce, 19, Milano, Porta Ticinese",Milan,milanotoday,https://www.milanotoday.it/eventi/rassegna-libri-podcast-casa-emergency.html,2025-12-22T16:47:19.631936+01:00,2025-06-11 00:00:00+02:00,,2025-06-11,0.0
reading party milano: domenica 16 novembre,,2025-11-16T00:00:00+01:00,,Urban Hive Milano,"Corso Garibaldi, 84, Milano, Porta Volta",Milan,milanotoday,https://www.milanotoday.it/eventi/reading-party-milano-domenica-16-novembre.html,2025-12-22T16:47:23.027793+01:00,2025-11-16 00:00:00+01:00,,2025-11-16,0.0
Reading party milano: domenica 19 ottobre,,2025-10-19T00:00:00+02:00,,Urban Hive Milano,"Corso Garibaldi, 84, Milano, Porta Volta",Milan,milanotoday,https://www.milanotoday.it/eventi/reading-party-milano-domenica-19-ottobre.html,2025-12-22T16:47:27.334005+01:00,2025-10-19 00:00:00+02:00,,2025-10-19,0.0
Reading party Milano: domenica 21 settembre,,2025-09-21T00:00:00+02:00,,Urban Hive Milano,"Corso Garibaldi, 84, Milano, Porta Volta",Milan,milanotoday,https://www.milanotoday.it/eventi/reading-party-milano-domenica-21-settembre.html,2025-12-22T16:47:30.985461+01:00,2025-09-21 00:00:00+02:00,,2025-09-21,0.0
Realme GT 8 pro mostra fotografica - Best street snap shooter,,2025-02-12T00:00:00+01:00,,Casa degli Artisti,"Via Tommaso da Cazzaniga, 89a, Milano, Porta Volta",Milan,milanotoday,https://www.milanotoday.it/eventi/realme-gt-8-pro-mostra-fotografica-best-street-snap-shooter.html,2025-12-22T16:47:33.966752+01:00,2025-02-12 00:00:00+01:00,,2025-02-12,0.0
"Red carpet, una sfilata di moda… e-motiva",,2025-11-21T00:00:00+01:00,,Biblioteca di Bollate,"Piazza Generale Carlo Alberto dalla Chiesa, 30, Bollate, ",Milan,milanotoday,https://www.milanotoday.it/eventi/red-carpet-una-sfilata-di-moda-e-motiva-emotivo-teatro.html,2025-12-22T16:47:37.282495+01:00,2025-11-21 00:00:00+01:00,,2025-11-21,0.0
Rejoice & friends - 140 voci in concerto,,2025-11-29T00:00:00+01:00,,Auditorium di MIlano,"Largo Gustav Mahler, Milano, Porta Ticinese",Milan,milanotoday,https://www.milanotoday.it/eventi/rejoice-friends-140-voci-in-concerto-rejoice-gospel-choir.html,2025-12-22T16:47:41.433500+01:00,2025-11-29 00:00:00+01:00,,2025-11-29,0.0
Remira vintage market in Isola,,2025-06-09T00:00:00+02:00,,Mercato Isola,"Piazzale Lagosta, 3, Milano, Isola",Milan,milanotoday,https://www.milanotoday.it/eventi/remira-vintage-market-in-isola-remira-market-6-7-settembre.html,2025-12-22T16:47:45.323360+01:00,2025-06-09 00:00:00+02:00,,2025-06-09,0.0
Remira vintage market,,2024-10-11T00:00:00+02:00,,Teatro Martinitt,", Milano, ",Milan,milanotoday,https://www.milanotoday.it/eventi/remira-vintage-market-remira-market.html,2025-12-22T16:47:47.930984+01:00,2024-10-11 00:00:00+02:00,,2024-10-11,0.0
"Republic Milano inaugura luglio con ""Friday"": musica elettronica d’autore e atmosfera d’eccellenza",,2025-04-07T00:00:00+02:00,,Republic Milano,"Piazza della Repubblica, 12, Milano, Porta Nuova",Milan,milanotoday,https://www.milanotoday.it/eventi/republic-milano-inaugura-luglio-con-friday-musica-elettronica-d-autore-e-atmosfera-d-eccellenza-dj-set.html,2025-12-22T16:47:51.868207+01:00,2025-04-07 00:00:00+02:00,,2025-04-07,0.0
"Torna Retrograde, il 'garage sale' con oltre 90mila capi per tutte le tasche (a partire da 1 euro)",Retrograde,2025-08-11T00:00:00+02:00,,Superstudio,"Via Tortona, 27, Milano, Tortona",Milan,milanotoday,https://www.milanotoday.it/eventi/retrograde-east-market-abiti-vintage.html,2025-12-22T16:47:55.407146+01:00,2025-08-11 00:00:00+02:00,,2025-08-11,0.0
"Lo spettacolo ""Riccardo III"" accende Milano: luci, visioni e follia al centro della scena",teatri,,,,,Milan,milanotoday,https://www.milanotoday.it/eventi/riccardo-iii.html,2025-12-22T16:47:58.136760+01:00,,,,
"'Riscatti', la mostra che racconta lo sguardo dei ragazzi con fragilità fisica",Riscatti,2025-10-14T00:00:00+02:00,,PAC - Padiglione d’arte contemporanea,"Via Palestro, 14, Milano, Porta Venezia",Milan,milanotoday,https://www.milanotoday.it/eventi/riscatti-mostra-pac-padiglione-arte-contemporanea.html,2025-12-22T16:48:01.861779+01:00,2025-10-14 00:00:00+02:00,,2025-10-14,0.0
Il Risorgimento come movimento anticattolico: libro di Angela Pellicciari a Milano,libri,2025-12-06T00:00:00+01:00,,Teatro Santo Domingo,"Via Rovigno, 11/A, Milano, Turro",Milan,milanotoday,https://www.milanotoday.it/eventi/risorgimento-chiesa-cattolica-libro-milano.html,2025-12-22T16:48:04.833572+01:00,2025-12-06 00:00:00+01:00,,2025-12-06,0.0
"Rooftop con vista, ingresso libero: tutto ciò che devi sapere sul nuovo party open air di Sabotage Milano",,2025-06-27T00:00:00+02:00,,I Mirador - 21 House Of Stories Navigli,"Via Privata Fratelli Angelo e Mario Bettinelli, 3, Milano, Porta Ticinese",Milan,milanotoday,https://www.milanotoday.it/eventi/rooftop-con-vista-ingresso-libero-tutto-cio-che-devi-sapere-sul-nuovo-party-open-air-di-sabotage-milano-lovin-duo-sunrush-lvca-12691108.html,2025-12-22T16:48:07.722512+01:00,2025-06-27 00:00:00+02:00,,2025-06-27,0.0
Rugby Sound Festival 2025. Programma e artisti dei grandi concerti di Legnano,Rugby Sound Festival,2025-03-07T00:00:00+01:00,,Isola del Castello,", Legnano, ",Milan,milanotoday,https://www.milanotoday.it/eventi/rugby-sound-festival-2025.html,2025-12-22T16:48:09.770257+01:00,2025-03-07 00:00:00+01:00,,2025-03-07,0.0
Al via il “Boing & Cartoonito tour”,,2025-09-20T00:00:00+02:00,,Piazza del Cannone,"Piazza del Cannone, Milano, Sempione",Milan,milanotoday,https://www.milanotoday.it/eventi/sabato-20-e-domenica-21-settembre-2025-piazza-del-cannone-milano-al-via-il-boing-cartoonito-tour.html,2025-12-22T16:48:13.089466+01:00,2025-09-20 00:00:00+02:00,,2025-09-20,0.0
sabato 21 giugno debutta all'area milano est lo show di leonardo decarli  “la vita è una mer…aviglia”,,2025-06-21T00:00:00+02:00,,Area Milano Est,"Via Riccardo Pitteri, 60, Milano, Ortica",Milan,milanotoday,https://www.milanotoday.it/eventi/sabato-21-giugno-debutta-all-area-milano-est-lo-show-di-leonardo-decarli-la-vita-e-una-mer-aviglia-leonardo-decarli.html,2025-12-22T16:48:15.488357+01:00,2025-06-21 00:00:00+02:00,,2025-06-21,0.0
Cena di socializzazione tra libertà e filosofie alimentari,,2025-11-22T00:00:00+01:00,,Be Bop,"Viale Col di Lana, 4, Milano, Porta Ticinese",Milan,milanotoday,https://www.milanotoday.it/eventi/sabato-22-novembre-2025-cena-di-socializzazione-tra-liberta-e-filosofie-alimentari-a-milano-mi.html,2025-12-22T16:48:17.763131+01:00,2025-11-22 00:00:00+01:00,,2025-11-22,0.0
Bim fest il festival di Bicocca torna per la terza edizione,,2025-09-27T00:00:00+02:00,,BiM,"Viale Piero e Alberto Pirelli, 10, Milano, Bicocca",Milan,milanotoday,https://www.milanotoday.it/eventi/sabato-27-e-domenica-28-settembre-bim-fest-il-festival-di-bicocca-torna-per-la-terza-edizione-tra-shopping-musica-arte-talk-e-incontri-workshop-e-laboratori-un-appuntamento-gratuito-aperto-a-tutti.html,2025-12-22T16:48:19.789175+01:00,2025-09-27 00:00:00+02:00,,2025-09-27,0.0
Sabotage hidden sunday at Cascina nascosta,,2025-09-21T00:00:00+02:00,,Cascina Nascosta,"Viale Emilio Alemagna, 14, Milano, Sempione",Milan,milanotoday,https://www.milanotoday.it/eventi/sabotage-hidden-sunday-at-cascina-nascosta-un-party-immerso-nel-verde-sabotage-sound-system.html,2025-12-22T16:48:22.373136+01:00,2025-09-21 00:00:00+02:00,,2025-09-21,0.0
Sabotage Milano torna ad Arca per l'opening dell'attesissimo Sunday Remedy,,2025-09-28T00:00:00+02:00,,Arca Milano,"Via Rimini, 38, Milano, Moncucco",Milan,milanotoday,https://www.milanotoday.it/eventi/sabotage-milano-torna-ad-arca-per-l-opening-dell-attesissimo-sunday-remedy-lvca-lovin-duo-sunrush.html,2025-12-22T16:48:25.091363+01:00,2025-09-28 00:00:00+02:00,,2025-09-28,0.0
Safe heart odv presenta aperitivo solidale e visita guidata della basilica di Sant’Ambrogio,,2025-09-18T00:00:00+02:00,,Oratorio della Passione,"Piazza Sant'Ambrogio, 5, Milano, Sant'Ambrogio",Milan,milanotoday,https://www.milanotoday.it/eventi/safe-heart-odv-presenta-il-18-settembre-a-milano-presso-l-oratorio-della-passione-aperitivo-solidale-e-visita-guidata-della-basilica-di-sant-ambrogio-safe-heart-odv.html,2025-12-22T16:48:27.805150+01:00,2025-09-18 00:00:00+02:00,,2025-09-18,0.0
Sagra dei porcini a Senago,,2025-09-18T00:00:00+02:00,,centro sportivo di Senago,"Via Giuseppe di Vittorio, 2, Senago, ",Milan,milanotoday,https://www.milanotoday.it/eventi/sagra-dei-porcini-a-senago-mi-mondosagre-2025.html,2025-12-22T16:48:30.056587+01:00,2025-09-18 00:00:00+02:00,,2025-09-18,0.0
Sagra del maialetto a Senago,,2025-06-19T00:00:00+02:00,,centro sportivo di Senago,"Via Giuseppe di Vittorio, 2, Senago, ",Milan,milanotoday,https://www.milanotoday.it/eventi/sagra-del-maialetto-a-senago-dal-19-al-29-giugno-mondosagre-12694321.html,2025-12-22T16:48:32.625585+01:00,2025-06-19 00:00:00+02:00,,2025-06-19,0.0
"Fritti, bruschette e gamberoni: la sagra del pesce a due passi da Milano",sagra del pesce,2025-10-07T00:00:00+02:00,,Centro sportivo di Senago,", Senago, ",Milan,milanotoday,https://www.milanotoday.it/eventi/sagra-del-pesce-senago-2025.html,2025-12-22T16:48:35.099103+01:00,2025-10-07 00:00:00+02:00,,2025-10-07,0.0
La sagra del gorgonzola (alle porte di Milano) con due giorni di degustazioni,sagra del gorgonzola,2025-09-20T00:00:00+02:00,,Gorgonzola,", Milano, ",Milan,milanotoday,https://www.milanotoday.it/eventi/sagra-gorgonzola-2025.html,2025-12-22T16:48:38.136171+01:00,2025-09-20 00:00:00+02:00,,2025-09-20,0.0
"Risottate, musica e crespelle: a due passi da Milano arriva la sagra del fungo porcino",sagra fungo porcino,2025-09-26T00:00:00+02:00,,Motta Visconti,", Motta Visconti, ",Milan,milanotoday,https://www.milanotoday.it/eventi/sagra-gungo-porcino-motta-visconti.html,2025-12-22T16:48:41.188700+01:00,2025-09-26 00:00:00+02:00,,2025-09-26,0.0
La grande sagra a due passi da Milano (con lo spettacolo finale di fuochi d'artificio),festa Olcella,2025-08-25T00:00:00+02:00,,Olcella,", Busto Garolfo, ",Milan,milanotoday,https://www.milanotoday.it/eventi/sagra-olcella-2025.html,2025-12-22T16:48:44.088970+01:00,2025-08-25 00:00:00+02:00,,2025-08-25,0.0
La sagra del pesce tra fritti misti e linguine allo scoglio,sagra del pesce,2025-05-30T00:00:00+02:00,,,", Melegnano, ",Milan,milanotoday,https://www.milanotoday.it/eventi/sagra-pesce-melegnano.html,2025-12-22T16:48:47.270105+01:00,2025-05-30 00:00:00+02:00,,2025-05-30,0.0
"Sagra del pesce di Trezzano: quando, dove e cosa si mangia",sagra del pesce,2025-06-13T00:00:00+02:00,,Trezzano,", Trezzano sul Naviglio, ",Milan,milanotoday,https://www.milanotoday.it/eventi/sagra-pesce-trezzano-2025.html,2025-12-22T16:48:50.236759+01:00,2025-06-13 00:00:00+02:00,,2025-06-13,0.0
"'Puglia Folk Fest', la sagra con tutte le specialità pugliesi",Parco Nord,2025-11-07T00:00:00+01:00,,Parco Nord,"Via Carlo Cattaneo, San Giuliano Milanese, Duomo",Milan,milanotoday,https://www.milanotoday.it/eventi/sagra-pugliese-parco-nord-2025.html,2025-12-22T16:48:53.225696+01:00,2025-11-07 00:00:00+01:00,,2025-11-07,0.0
"Porcini, zafferano, Barolo: la sagra del risotto 'all you can eat'",,2025-10-17T00:00:00+02:00,,Contrada San Domenico di Legnano,"Via Nino Bixio, Legnano, ",Milan,milanotoday,https://www.milanotoday.it/eventi/sagra-risotto-all-you-can-eat-legnano.html,2025-12-22T16:48:55.845522+01:00,2025-10-17 00:00:00+02:00,,2025-10-17,0.0
La sagra di San Lorenzo (e uno speciale spettacolo pirotecnico) alle porte di Milano,sagra di san lorenzo,2025-05-09T00:00:00+02:00,,San Lorenzo,", Parabiago, ",Milan,milanotoday,https://www.milanotoday.it/eventi/sagra-san-lorenzo-parabiago.html,2025-12-22T16:48:58.758455+01:00,2025-05-09 00:00:00+02:00,,2025-05-09,0.0
"La sagra spagnola con paella, sangria e tapas",Legnano,2025-07-25T00:00:00+02:00,,Contrada San Domenico di Legnano,"Via Nino Bixio, 6, Legnano, ",Milan,milanotoday,https://www.milanotoday.it/eventi/sagra-spagnola-legnano-2025.html,2025-12-22T16:49:01.648802+01:00,2025-07-25 00:00:00+02:00,,2025-07-25,0.0
"Cibo, musica e giochi per bambini: un mese di festa con la Sagra della Trebbiatura",Sagra della Trebbiatura,2025-06-09T00:00:00+02:00,,Noviglio,"Piazza XI Settembre, Milano, ",Milan,milanotoday,https://www.milanotoday.it/eventi/sagra-trebbiatura-2025-noviglio.html,2025-12-22T16:49:05.006532+01:00,2025-06-09 00:00:00+02:00,,2025-06-09,0.0
I sapori dell'autunno protagonisti della sagra della zucca e dei funghi porcini,sagra dei funghi,2025-07-11T00:00:00+02:00,,Contrada San Bernardino di Legnano,"Via Somalia, 13, Legnano, ",Milan,milanotoday,https://www.milanotoday.it/eventi/sagra-zucca-funghi-legnano.html,2025-12-22T16:49:08.410664+01:00,2025-07-11 00:00:00+02:00,,2025-07-11,0.0
Saliamo tutti,,2025-10-10T00:00:00+02:00,,Casa Testori,"Largo Angelo Testori, 13, Novate Milanese, ",Milan,milanotoday,https://www.milanotoday.it/eventi/saliamo-tutti-vari.html,2025-12-22T16:49:10.915856+01:00,2025-10-10 00:00:00+02:00,,2025-10-10,0.0
"Salvalibro 3librix10€ torna a milano! Libri vintage, sconti e novità per gli under 30",,2025-11-23T00:00:00+01:00,,Rotonda del Pellegrini,"Via delle Ore, 3, Milano, Duomo",Milan,milanotoday,https://www.milanotoday.it/eventi/salvalibro-3librix10-torna-a-milano-libri-vintage-sconti-e-novita-per-gli-under-30.html,2025-12-22T16:49:13.605211+01:00,2025-11-23 00:00:00+01:00,,2025-11-23,0.0
Visita guidata al castello di San Colombano al Lambro e all'oratorio di San Rocco con apertura straordinaria,,2025-11-16T00:00:00+01:00,,ingresso del Castello,"Via Principessa Maddalena Belgioioso, 77, San Colombano al Lambro, ",Milan,milanotoday,https://www.milanotoday.it/eventi/san-colombano-al-lambro-visita-guidata-al-castello-e-all-oratorio-di-san-rocco-con-apertura-straordinaria.html,2025-12-22T16:49:16.352350+01:00,2025-11-16 00:00:00+01:00,,2025-11-16,0.0
"Santi, balordi e poveri cristi",,2025-11-21T00:00:00+01:00,,Apres-Coup,"Via Privata della Braida, 5, Milano, Porta Romana",Milan,milanotoday,https://www.milanotoday.it/eventi/santi-balordi-e-poveri-cristi-giulia-angeloni-e--flavia-ripa.html,2025-12-22T16:49:20.233115+01:00,2025-11-21 00:00:00+01:00,,2025-11-21,0.0
"Santi, balordi e poveri cristi",,2025-10-19T00:00:00+02:00,,LIBROSTERIA,"Via Cesare Cesariano, 7, Milano, Chinatown",Milan,milanotoday,https://www.milanotoday.it/eventi/santi-balordi-e-poveri-cristi-giulia-angeloni-e-flavia-ripa.html,2025-12-22T16:49:22.638077+01:00,2025-10-19 00:00:00+02:00,,2025-10-19,0.0
A Mercato Centrale Milano un viaggio tra i profumi e i sapori autentici dell’Umbria,I Profumi del Bosco,,,,,Milan,milanotoday,https://www.milanotoday.it/eventi/sapori-umbria-milano.html,2025-12-22T16:49:25.926392+01:00,,,,
"Save the date - mostra fotografica Afghanistan al museo Maio di Cassina de' Pecchi, sabato 15/11 ore 16.00",,2025-11-15T00:00:00+01:00,,Museo MAIO,"Via Trieste, 3, Cassina de' Pecchi, ",Milan,milanotoday,https://www.milanotoday.it/eventi/save-the-date-mostra-fotografica-afghanistan-al-museo-maio-di-cassina-de-pecchi-sabato-15-11-ore-16-00-robertino-radovix.html,2025-12-22T16:49:28.967611+01:00,2025-11-15 00:00:00+01:00,,2025-11-15,0.0
bund up comedy show,,2025-12-18T00:00:00+01:00,,Sbunda,"Via Privata del Don 1, Milano, Porta Ticinese",Milan,milanotoday,https://www.milanotoday.it/eventi/sbund-up-comedy-show-karl-mirabelli-13272000.html,2025-12-22T16:49:31.714011+01:00,2025-12-18 00:00:00+01:00,,2025-12-18,0.0
Trasforma vecchi capi d'abbigliamento e ricevi fantastici premi con il contest Seconda Chance,seconda chance Contest abiti,,,,,Milan,milanotoday,https://www.milanotoday.it/eventi/seconda-chance-contest.html,2025-12-22T16:49:33.823274+01:00,,,,
"Segni di bellezza XI stagione, anima mundi: il respiro",,2025-08-11T00:00:00+02:00,,BASILICA DI SANT'EUSTORGIO,"Piazza Sant'Eustorgio, 1, Milano, Porta Ticinese",Milan,milanotoday,https://www.milanotoday.it/eventi/segni-di-bellezza-xi-stagione-anima-mundi-il-respiro-orchestra-milano-classica-direttore-michele-brescia-soprano-ilaria-vanacore.html,2025-12-22T16:49:36.078273+01:00,2025-08-11 00:00:00+02:00,,2025-08-11,0.0
"Senago, torna la sagra dei risotti e dei canederli: ultimi giorni della stagione tra sapori tipici e lotteria",,2025-11-21T00:00:00+01:00,,centro sportivo di Senago,"Via Giuseppe di Vittorio, 2, Senago, ",Milan,milanotoday,https://www.milanotoday.it/eventi/senago-torna-la-sagra-dei-risotti-e-dei-canederli-ultimi-giorni-della-stagione-tra-sapori-tipici-e-lotteria-mondosagre.html,2025-12-22T16:49:39.188268+01:00,2025-11-21 00:00:00+01:00,,2025-11-21,0.0
"Sequoia Milano: il sabato sera che non ti aspetti, tra vino libero e vibrazioni",,2025-09-20T00:00:00+02:00,,SEQUOIA MILANO,"Via Camillo Finocchiaro Aprile, 9/A, Milano, Porta Venezia",Milan,milanotoday,https://www.milanotoday.it/eventi/sequoia-milano-il-sabato-sera-che-non-ti-aspetti-tra-vino-libero-e-vibrazioni.html,2025-12-22T16:49:42.162713+01:00,2025-09-20 00:00:00+02:00,,2025-09-20,0.0
La serata '90special' nel cuore della nightlife milanese,El Jadida,2025-12-09T00:00:00+01:00,,El Jadida,"Via Carlo Bazzi, 47, Milano, Stadera",Milan,milanotoday,https://www.milanotoday.it/eventi/serata-90special-jadida.html,2025-12-22T16:49:45.989015+01:00,2025-12-09 00:00:00+01:00,,2025-12-09,0.0
"Serata all'opera al teatro ""La creta""",,2025-10-18T00:00:00+02:00,,"Cineteatro ""La Creta""","Via dell'Allodola, Milano, Lorenteggio",Milan,milanotoday,https://www.milanotoday.it/eventi/serata-all-opera-al-teatro-la-creta-zona-inganni-elysium-chorus-aps-con-la-corale-arnatese-insieme-all-opera-simphony-orchestra-con-la-pianista-ahn-eunmi-diretti-dal-maestro-gianfranco-messina.html,2025-12-22T16:49:48.822511+01:00,2025-10-18 00:00:00+02:00,,2025-10-18,0.0
"Vision open air all'Ex Macello con Peggy Gou, Paswa e Solomun",discoteche,2025-09-25T00:00:00+02:00,,Ex Macello,"Viale Molise, 62, Milano, Ortomercato",Milan,milanotoday,https://www.milanotoday.it/eventi/serata-ex-macello-con-peggy-gou-paswa-solomun.html,2025-12-22T16:49:51.943985+01:00,2025-09-25 00:00:00+02:00,,2025-09-25,0.0
Le Cannibale presenta una nuova serata per ballare fino all'alba,Le Cannibale,2025-08-11T00:00:00+02:00,,Triennale Milano,"Viale Emilio Alemagna, 6, Milano, Sempione",Milan,milanotoday,https://www.milanotoday.it/eventi/serata-le-cannibale-triennale.html,2025-12-22T16:49:54.637861+01:00,2025-08-11 00:00:00+02:00,,2025-08-11,0.0
La 'Pizza Night' nel cuore di Milano (alla scoperta dei sapori siciliani),Eataly Smeraldo,2025-10-07T00:00:00+02:00,,Eataly Milano Smeraldo,"Piazza XXV Aprile, 10, Milano, Porta Volta",Milan,milanotoday,https://www.milanotoday.it/eventi/serata-pizza-eataly-smeraldo.html,2025-12-22T16:49:57.881243+01:00,2025-10-07 00:00:00+02:00,,2025-10-07,0.0
Una speciale serata di 'storie da bar' (con una birra gratis),Pils Pub,2025-09-15T00:00:00+02:00,,PILS PUB,"Via Agostino Bertani, 2, Milano, Sempione",Milan,milanotoday,https://www.milanotoday.it/eventi/serata-storie-da-bar-pils-pub.html,2025-12-22T16:50:00.995343+01:00,2025-09-15 00:00:00+02:00,,2025-09-15,0.0
"Presentazione ""Codice Ratzinger”: Leone XIV: papa o antipapa?",,2025-12-10T00:00:00+01:00,,presso Acquedotto 33,"Via Giuseppe Mazzini, 33, Sesto San Giovanni, ",Milan,milanotoday,https://www.milanotoday.it/eventi/sesto-san-giovanni-presentazione-del-libro-bestseller-2022-codice-ratzinger-leone-xiv-papa-o-antipapa-conferenza-di-andrea-cionci-autore-del-best-seller-codice-ratzinger-andrea-cionci.html,2025-12-22T16:50:04.123579+01:00,2025-12-10 00:00:00+01:00,,2025-12-10,0.0
Sfilata di moda sposa alla Fiera sposi nozze d'autore a Villa Borromeo di Cassano D'Adda,,2025-11-23T00:00:00+01:00,,Villa Borromeo,"Via Vittorio Veneto, 58, Cassano d'Adda, ",Milan,milanotoday,https://www.milanotoday.it/eventi/sfilata-di-moda-sposa-alla-fiera-sposi-nozze-d-autore-a-villa-borromeo-di-cassano-d-adda.html,2025-12-22T16:50:07.015413+01:00,2025-11-23 00:00:00+01:00,,2025-11-23,0.0
"“Sfrecciamo per un sorriso: motori, bimbi e magia”",,2025-12-14T00:00:00+01:00,,Policlinico di Milano,"Via della Commenda, 10, Milano, Porta Romana",Milan,milanotoday,https://www.milanotoday.it/eventi/sfrecciamo-per-un-sorriso-motori-bimbi-e-magia-iniziativa-del-gruppo-di-motociclisti-gg-friends-in-collaborazione-con-la-fondazione-francesca-rava-e-con-il-patrocinio-del-comune-di-milano.html,2025-12-22T16:50:10.122974+01:00,2025-12-14 00:00:00+01:00,,2025-12-14,0.0
